{
  "$schema": "http://json-schema.org/draft-07/schema#",
  "additionalProperties": false,
  "definitions": {
    "BinomialLitter": {
      "additionalProperties": false,
      "properties": {
        "group": {
          "format": "uint",
          "minimum": 0.0,
          "type": "integer"
        },
        "successes": {
          "format": "uint32",
          "minimum": 0.0,
          "type": "integer"
        },
        "total": {
          "format": "uint32",
          "minimum": 0.0,
          "type": "integer"
        }
      },
      "required": [
        "group",
        "successes",
        "total"
      ],
      "type": "object"
    },
    "ProbitNormalFitSchema": {
      "enum": [
        "qspquest.probit-normal-binomial-fit/v0.1"
      ],
      "type": "string"
    }
  },
  "properties": {
    "gradient_tolerance": {
      "format": "double",
      "type": "number"
    },
    "initial_means": {
      "items": {
        "format": "double",
        "type": "number"
      },
      "maxItems": 2,
      "minItems": 2,
      "type": "array"
    },
    "initial_sds": {
      "items": {
        "format": "double",
        "type": "number"
      },
      "maxItems": 2,
      "minItems": 2,
      "type": "array"
    },
    "max_evaluations": {
      "format": "uint",
      "minimum": 0.0,
      "type": "integer"
    },
    "max_iterations": {
      "format": "uint",
      "minimum": 0.0,
      "type": "integer"
    },
    "max_quadrature_evaluations": {
      "format": "uint",
      "minimum": 0.0,
      "type": "integer"
    },
    "mean_bounds": {
      "items": {
        "items": {
          "format": "double",
          "type": "number"
        },
        "maxItems": 2,
        "minItems": 2,
        "type": "array"
      },
      "maxItems": 2,
      "minItems": 2,
      "type": "array"
    },
    "observations": {
      "items": {
        "$ref": "#/definitions/BinomialLitter"
      },
      "type": "array"
    },
    "schema": {
      "$ref": "#/definitions/ProbitNormalFitSchema"
    },
    "sd_bounds": {
      "items": {
        "items": {
          "format": "double",
          "type": "number"
        },
        "maxItems": 2,
        "minItems": 2,
        "type": "array"
      },
      "maxItems": 2,
      "minItems": 2,
      "type": "array"
    }
  },
  "required": [
    "gradient_tolerance",
    "initial_means",
    "initial_sds",
    "max_evaluations",
    "max_iterations",
    "max_quadrature_evaluations",
    "mean_bounds",
    "observations",
    "schema",
    "sd_bounds"
  ],
  "title": "ProbitNormalBinomialFitRequest",
  "type": "object",
  "x-qspquest-spec-version": "qspquest.spec/0.1",
  "x-qspquest-validation": "Structural schema only; compile, bind and validate execution capabilities before running."
}
